,company,job title,location,job description,salary estimate,company_size,company_type,company_sector,company_industry,company_founded,company_revenue
79,"Kmart
3.4",Senior Data Scientist,Bangalore,"Brighter futures start here
At KAS services you’ll be joining a diverse team who come together to collaborate globally around tech. We are an innovation hub which power and support our retail brands. You’ll feel the impacts of the work you’ll do for our millions of customers and team members every day. Our brands are focused on being customer-led, digitally enabled retailers, providing you with challenging and rewarding work that you will be proud of.
Join our team, choose your own path and work on projects that excite you.

4+ years of relevant experience in advanced analytics role preferably in Retail / CPG domain.
Should have worked on projects / initiatives in merchandizing analytics, digital analytics
Prior experience in machine learning & big data analytics necessary.
Experience in productionalization of analytics products will be a plus Track record in managing deliveries of advanced analytical solutions in an agile & iterative model.

A place you can belong
We celebrate the rich diversity of the communities in which we operate and are committed to creating inclusive and safe environments where all our team members can contribute and succeed. We believe that all team members should feel valued, respected, and safe irrespective of your gender, ethnicity, indigeneity, religious beliefs, education, age, disability, family responsibilities, sexual orientation and gender identity and we encourage applications from all candidates.
Show Less
Report","₹3,32,718 /yr (est.)",10000+ Employees,Subsidiary or Business Segment,Retail & Wholesale,General Merchandise & Superstores,1899,$5 to $10 billion (USD)
80,"Lenskart
4.0",Data Scientist,Gurgaon,"Lenskart was founded with a vision to help people see the beautiful world by revolutionizing the eyewear category in India and beyond. The ten-year-old company now delivers 7 million + spectacles a year in India and Singapore and plans to ship out over a billion glasses over the next ten years. Lenskart being an Omni-channel direct to consumer retail brand provides a unique ecosystem of a full spectrum of analytics use cases which very few companies in the world provide. This creates a unique challenge and opportunity for professionals to learn and contribute, at the same time solve a 2 billion+ problem.

Analytics and data science are core to Lenskart’s business across several aspects: retail & store analytics, digital & e-commerce analytics, marketing analytics, supply chain analytics, customer service, text analytics and more.

While the DS team works centrally, we are deeply embedded with the functional teams and have a very strong say in the operational strategy. We are looking for a strong Data Scientist to work on Advanced Analytics use cases who will enable the use of advanced analytics for the area of Customer analytics, Marketing analytics, Text analytics for helping improve marketing ROI and
customer experience

About Lenskart Analytics Team - https://blog.lenskart.com/introducing-analytics-lenskart-f007bd3b9c02

Key Responsibilities:
Experience using machine learning libraries or platforms such as Tensorflow, Scikit-Learn, Spark ML, Python, SQL, Redshift, and knowledge of AWS environment.
Synthesize large volumes of data with attention to granular details and present findings and recommendations to senior-level stakeholders using advanced modelling & algorithm.
Perform online reporting, collection and analysis of digital metrics, process large clickstream data sets from Google Analytics/Big query to provide online user experience improvement.
Analyze the customer base and build a strong customer segmentation framework to look at our customer base in a strategic manner.
Leverage customer data to build churn models, propensity models etc. to increase the efficiency of our marketing spend.
Working closely with the channel teams on campaign optimization.
Leverage customer chat data for applications in text analytics such as sentiment analysis, NPS prediction, topic modelling etc.
Ability to translate advanced analytics problems into an ML model (deep learning, decision trees, Random forest, GBM, Bayesian models, etc.).
Knowledge of MMM Modelling and MTA Modelling is good to have.
Experience in Retail, Ecommerce, and Marketing advanced analytics ML problems is a must with a deep understanding of one area.
Strong analytical and communication skills. Should be self-driven, highly motivated and able to learn quickly.

Strong understanding of analytics needs and proactive-ness to build generic solutions to improve efficiency.
Lead/Work with many global teams, communicate effectively, both written and verbal, with technical and non-technical multi-functional teams.
Strong project management and communication skills, Excel / PowerPoint / Agile /Jira experience.
Most important - Passion for solving business problems with the use of algorithms, analytics and technology.

Education:
Bachelor's / Master’s Degree or Equivalent with 1-3 years of experience in Advanced Analytics roles.
A background in Computer science or statistics from Tier 1 / 2 colleges with strong academics.

Location:
Gurgaon

Good to have:
Candidate needs to have 2-5 years of relevant experience, and a passion for solving business problems with the use of algorithms, analytics, ML and technology skills.
Strong hands-on experience with Python & SQL with a minimum of 2 years of live projects.
Experience in working with analytics tools like Power BI, Tableau etc.
Strong capability to understand business problems in the context of an Omni Channel Retail and use data to solve them.
Strong understanding of marketing analytics concepts, attribution, modelling, etc.
Excellent communication, teamwork and problem-solving skills.
Show Less
Report","₹5,13,832 /yr (est.)",1001 to 5000 Employees,Company - Private,Retail & Wholesale,Other Retail Shops,2008,Unknown / Non-Applicable
81,Atop Consultants,Data Scientist,India,"We are Hiring for a leading NBFC
Job title: Data Scientist
Location : Mumbai
Experience: Min 4 years (BFSI) as a Data Scientist
1: Job Purpose Statement:
The role of Data Scientist shall be to work on projects on analytics and reporting for MMFSL businesses by using high end analytical tools.
2: Duties & Responsibilities:
a. Shall be the specialist on Data Science/Analytics vertical at MMFSL. Shall collaborate with business managers to solve their business-data-challenges and provide impactful insights
b. The incumbent will interact with multiple members from client side by meeting them, interviewing them, taking data and processing it.
c. The incumbent will be creating the insights from data extracted from business units and converting them into a ""consumable format"" or ""self-servicing predictive portals"" for clients.
d. The incumbent would need to be hands on with use of Data Science tools like, R, Python, Azure ML, Amazon ML, Google ML etc. Ability to self-process the data and come out with models/ insights is a must.
e. Needs to apply sophisticated AI tools like Randomforests, Support Vector Machines, Deep neural networks, Advanced Regression, etc. techniques to data problems.
3: Key Challenges:
 Able to explain key Data science approaches in layman term to the business people.
 Able to understand the business requirement and translate them into algorithm.
Job Types: Full-time, Regular / Permanent
Salary: ₹1,000,000.00 - ₹1,700,000.00 per year
Schedule:
Evening shift
Flexible shift
Monday to Friday
Night shift
Supplemental pay types:
Overtime pay
Shift allowance
Ability to commute/relocate:
Worli, Mumbai, Maharashtra: Reliably commute or planning to relocate before starting work (Required)
Experience:
BFSI Data Scientist: 4 years (Required)
Speak with the employer
+91 9106422484
Show Less
Report","₹13,50,000 /yr (est.)",#N/A,#N/A,#N/A,#N/A,#N/A,#N/A
82,"Intellect Design Arena
4.0",Data Scientist,Chennai,"Who we are looking for
A Natural Language Processing (NLP) expert with strong computer science fundamentals and experience in working with deep learning frameworks. You will be working at the cutting edge of NLP and Machine Learning.

Roles and Responsibilities
Work as part of a distributed team to research, build and deploy Machine Learning models for NLP.
Mentor and coach other team members
Evaluate the performance of NLP models and ideate on how they can be improved
Support internal and external NLP-facing APIs
Keep up to date on current research around NLP, Machine Learning and Deep Learning
Mandatory Requirements
Any graduation with at least 2 years of demonstrated experience as a Data Scientist.
Behavioural Skills
Strong analytical and problem-solving capabilities.
Proven ability to multi-task and deliver results within tight time frames
Must have strong verbal and written communication skills
Strong listening skills and eagerness to learn
Strong attention to detail and the ability to work efficiently in a team as well as individually
Technical Skills
Hands-on experience with
NLP
Deep Learning
Machine Learning
Preferred Requirements
Experience in Computer Vision is preferred
What We Offer
At Intellect, we believe in the power of dreams and we follow a simple but vital premise – If you dream it, you can do it. As a Data Scientist, you will evaluate and improve Intellect’s products. You will collaborate with a multi-disciplinary team of Engineers and Analysts on a wide range of problems, bringing analytical rigor and statistical methods to the challenges of measuring quality, improving products and understanding the behavior of end-users.
Intellect proudly offers the opportunity to work in an environment built on collaboration, flexibility and respect.
Show Less
Report","₹8,99,373 /yr (est.)",1001 to 5000 Employees,Company - Public,Information Technology,Computer Hardware Development,2014,$100 to $500 million (USD)
83,"Atotech
4.1",Data Scientist,India,"Atotech, a brand within the Materials Solution Division on MKS Instruments, develops leading process and manufacturing technologies for advanced surface modification, electroless and electrolytic plating, and surface finishing. Applying a comprehensive systems-and-solutions approach, Atotech's portfolio includes chemistry, equipment, software, and services for innovative and high-technology applications. These solutions are used in a wide variety of end-markets, including datacenter, consumer electronics and communications infrastructure, as well as in numerous industrial and consumer applications such as automotive, heavy machinery, and household appliances.
With its well established innovative strength and industry-leading global TechCenter network, MKS delivers pioneering solutions through its Atotech brand - combined with unparalleled on-site support for customers worldwide. For more information about Atotech, please visit us at atotech.com

Job Profile
We are looking for a Data Scientist who will support our product development and leadership teams with insights gained from analysing R&D data. Data scientist is needed to guide the data gathering and data mapping techniques used in the ELN project. Currently we are collecting data in a team-oriented structure, and we require a data scientist to look in to these data structure to identify the similarity and corelation in a statistical method. Data scientist is also needed to summarize the findings by using dashboarding functionalities in TIBCO Spotfire. The right candidate will have a passion for discovering solutions hidden in large data sets and working with stakeholders to improve business outcomes.

Responsibilities
Work with stakeholders throughout the organization to identify opportunities for leveraging company data to drive business solutions.
Mine and analyze data from company databases to drive optimization and improvement of product development, marketing techniques and business strategies.
Assess the effectiveness and accuracy of new data sources and data gathering techniques.
Develop custom data models and algorithms to apply to data sets.
Use predictive modeling to increase and optimize customer experiences, revenue generation, ad targeting and other business outcomes.
Develop company A/B testing framework and test model quality.
Coordinate with different functional teams to implement models and monitor outcomes.
Develop processes and tools to monitor and analyze model performance and data accuracy.

Skills we are looking for
Strong problem solving skills with an emphasis on chemical product development.
Experience using statistical computer languages (R, Python, SLQ, etc.) to manipulate data and draw insights from large data sets.
Experience working with and creating data architectures.
Knowledge of a variety of machine learning techniques (clustering, decision tree learning, artificial neural networks, etc.) and their real-world advantages/drawbacks.
Knowledge of advanced statistical techniques and concepts (regression, properties of distributions, statistical tests and proper usage, etc.) and experience with applications.
Excellent written and verbal communication skills for coordinating across teams.
A drive to learn and master new technologies and techniques.
Required
We’re looking for someone with 1-3 years of experience manipulating data sets and building statistical models, has a Bachelors or Masters or PhD in Statistics, Mathematics, Computer Science, Bioinformatics or another quantitative field, and is familiar with the following software/tools:
Coding knowledge and experience with several languages: Javascript,VBscrpipt.
Knowledge and experience in statistical and data mining techniques: GLM/Regression, Random Forest, Boosting, Trees, text mining.
Experience querying databases and using statistical computer languages: R or Python.
Experience creating and using advanced machine learning algorithms and statistics: regression, simulation, scenario analysis, modeling, clustering, decision trees, neural networks, etc.
Experience with distributed data/computing tools: Map/Reduce, MySQL
Experience visualizing/presenting data for stakeholders using: Periscope, Business Objects, D3, ggplot, TIBCO spotfire.""
Experience in modeling, de novo prediction, structure visualization and analysis, docking, molecular dynamics, and structure- based small molecules.
Show Less
Report",#N/A,1001 to 5000 Employees,Company - Private,Manufacturing,Chemical Manufacturing,1993,$2 to $5 billion (USD)
84,"Cyient
3.5",Data Scientist,Hyderābād,"Cyient is a global engineering and technology solutions company. As a Design, Build, and Maintain partner for leading organizations worldwide, we take solution ownership across the value chain to help clients focus on their core, innovate, and stay ahead of the curve. We leverage digital technologies, advanced analytics capabilities, and our domain knowledge and technical expertise, to solve complex business problems.
With over 15,000 employees globally, we partner with clients to operate as part of their extended team in ways that best suit their organization’s culture and requirements. Our industry focus includes aerospace and defence, healthcare, telecommunications, rail transportation, semiconductor, geospatial, industrial, and energy.
Job Description
Cyient is looking for energetic and disruptive Geospatial Data Scientists to join our Geospatial team. We’re looking for experienced people who know how to create and analyze Geospatial data using the latest Artificial Intelligence frameworks. You should be an expert in building fully automated data pipelines that require as little human intervention as possible.
You’ll also need to be good at understand customer needs and ensuring that what you build is the most efficient way to address these, even if it means building something new or different to existing established systems.
Your Skills
Creating and analyzing geospatial datasets using Artificial Intelligence:
Semantic segmentation (from mobile imagery or aerial/satellite imagery).
Labelling/Annotation, training and validation.
Feature identification.
Computer Vision based Feature extraction.
Geometry correction.
Hosting and Visualization.
Automated data pipelines for AI
Data Processing (imagery, geospatial data).
Conversion.
GPU processing and cloud architecture for efficient data manipulation.
Creating services-based architecture combining multiple components towards a outcome.
Application Industrialization/scale-up (Devops principles for deployment of large scale deployments in real-world production environments).
Experience of ‘human in the loop’ flowlines but with an emphasis in removing as much of the human element as possible, whilst ensuring sufficient governance and oversight for the creation of good quality outputs.
Technical Abilities
Geospatial software and platforms such as PostGIS, Esri, QGIS.
Geospatial data toolsets such as GDAL
Data and automation technology such as Python
AI specific tools such as TensorFlow, Pytorch, CNTK, Caffee, etc)
Big Data (Databricks, Kubernetes, Azure data lake/data factory, etc)
Geospatial data formats including Lidar, Aerial Imagery, Satellite Imagery and potentially SAR and hyperspectral.
Skills & Experience
Artificial Intelligence (AI), Computer Vision, Geospatial, Python
Cyient is an Equal Opportunity Employer.

Cyient recruits, employs, trains, compensates, and promotes regardless of race, color, ancestry, religion, sex, national origin, sexual orientation, age, citizenship, marital status, disability, gender, gender identity or expression, veteran status, and other protected status as required by applicable law. We are proud to be a diverse and inclusive company where our people can focus their whole self on solving problems that matter.
Show Less
Report","₹4,83,918 /yr (est.)",10000+ Employees,Company - Public,Information Technology,Information Technology Support Services,1991,$500 million to $1 billion (USD)
85,Claim Genius india Pvt Ltd,Junior Data Scientist,Pune,"1. Data Scientist:
Position: Data Scientist / Sr. Data Scientist / Data Analyst / Sr. Data Analyst
Experience: 1+/3+ Years[Relevant Skills]
Location: Pune
Responsibilities :
The Machine Learning Software Engineer will be an early member of a growing team with responsibilities for designing and developing highly scalable machine learning solutions that impact many areas of our business.
The individual in this role will help in the design and development of Neural Network (especially Convolution Neural Networks) & ML solutions based on our reference architecture which is underpinned by big data & cloud technology, micro-service architecture and high performing compute infrastructure.
Typical daily activities include contributing to all phases of algorithm development including ideation, prototyping, design, and development production implementation.
Desired Candidate Profile
Required Skills :
Expertise in CNN, Image Processing, Computer Vision and Deep Learning is a must.
An ideal candidate will have a background in software engineering and data science with expertise in machine learning algorithms, statistical analysis tools, and distributed systems.
Experience in building machine learning applications, and broad knowledge of machine learning APIs, tools, and open-source libraries
Strong coding skills and fundamentals in data structures, predictive modeling, and big data concepts
Experience in designing full stack ML solutions in a distributed computing environment
Experience working with Python, Tensor Flow, Keras, Sci-kit, pandas, numpy, AzureML, AWS GPU
Excellent communication skills with multiple levels of the organization
Job Type: Full-time
Salary: ₹400,000.00 - ₹800,000.00 per year
Benefits:
Flexible schedule
Health insurance
Provident Fund
Schedule:
Day shift
Ability to commute/relocate:
Pune, Pune - 411045, Maharashtra: Reliably commute or planning to relocate before starting work (Required)
Experience:
Image processing: 1 year (Required)
Work Location: One location
Speak with the employer
+91 9960877222
Application Deadline: 09/12/2022
Expected Start Date: 02/01/2023
Show Less
Report","₹6,00,000 /yr (est.)",#N/A,#N/A,#N/A,#N/A,#N/A,#N/A
86,"Ayruz Data Marketing
4.4",Data Scientist,Kerala,"Experience: 1 year or more
Qualification: B-Tech, M-Tech, MSc (IT, Computer Science, Electronics Science)
Vacancies: 02
Description: We are looking for a Data Scientist who will support our product, sales, leadership and marketing teams with insights gained from analyzing company data. The ideal candidate is adept at using large data sets to find opportunities for product and process optimization and using models to test the effectiveness of different courses of action. They must have strong experience using a variety of data mining/data analysis methods, using a variety of data tools, building and implementing models, using/creating algorithms and creating/running simulations. They must have a proven ability to drive business results with their data-based insights. They must be comfortable working with a wide range of stakeholders and functional teams. The right candidate will have a passion for discovering solutions hidden in large datasets and working with stakeholders to improve business outcomes.
Responsibilities for Data Scientist
Specialization in fields like math, statistics, computer science, or something closely related.
Work with large amounts of data: facts, figures, and number crunching. See through the data and analyze & interpret it to find conclusions.
Present their findings, or translate the data into an understandable document. You will need to write and speak clearly, easily communicating complex ideas.
Look at the numbers, trends, and data and come to new conclusions based on the findings.
Have to make sure they are vigilant in their analysis to come to correct conclusions.
Strong math and analysis skills are needed to estimate numerical data.

Core skills/experience
Have an interest in sports. Data collection will be related to sports.
Know any of the scripting language (Preferred: Python).
Experience in participating in new business pitches.
Excellent organizational and time management skills with strong attention to detail.
Experience in working professionally with Word, Excel, and PowerPoint.
We’d like you to be
Self-motivated and able to work within a dynamic environment.
Good under pressure and can multitask without a reduction in work quality and concentration.
A great communicator, both verbal and written.
Experience working in a similar agency environment, although not essential.
The package
We offer a good salary, negotiable dependent on qualifications and experience. On top of this, we have a generous benefits package.
Interviews will be held immediately on receipt of suitable applications.
Show Less
Report",#N/A,1 to 50 Employees,Self-employed,#N/A,#N/A,#N/A,Unknown / Non-Applicable
