company,job title,location,job description,salary estimate,company_size,company_type,company_sector,company_industry,company_founded,company_revenue,hourly,monthly,company_txt,age,python_yn,R_yn,spark,aws,excel
Claim Genius india Pvt Ltd,Junior Data Scientist,Pune,"1. Data Scientist:
Position: Data Scientist / Sr. Data Scientist / Data Analyst / Sr. Data Analyst
Experience: 1+/3+ Years[Relevant Skills]
Location: Pune
Responsibilities :
The Machine Learning Software Engineer will be an early member of a growing team with responsibilities for designing and developing highly scalable machine learning solutions that impact many areas of our business.
The individual in this role will help in the design and development of Neural Network (especially Convolution Neural Networks) & ML solutions based on our reference architecture which is underpinned by big data & cloud technology, micro-service architecture and high performing compute infrastructure.
Typical daily activities include contributing to all phases of algorithm development including ideation, prototyping, design, and development production implementation.
Desired Candidate Profile
Required Skills :
Expertise in CNN, Image Processing, Computer Vision and Deep Learning is a must.
An ideal candidate will have a background in software engineering and data science with expertise in machine learning algorithms, statistical analysis tools, and distributed systems.
Experience in building machine learning applications, and broad knowledge of machine learning APIs, tools, and open-source libraries
Strong coding skills and fundamentals in data structures, predictive modeling, and big data concepts
Experience in designing full stack ML solutions in a distributed computing environment
Experience working with Python, Tensor Flow, Keras, Sci-kit, pandas, numpy, AzureML, AWS GPU
Excellent communication skills with multiple levels of the organization
Job Type: Full-time
Salary: ₹400,000.00 - ₹800,000.00 per year
Benefits:
Flexible schedule
Health insurance
Provident Fund
Schedule:
Day shift
Ability to commute/relocate:
Pune, Pune - 411045, Maharashtra: Reliably commute or planning to relocate before starting work (Required)
Experience:
Image processing: 1 year (Required)
Work Location: One location
Speak with the employer
+91 9960877222
Application Deadline: 09/12/2022
Expected Start Date: 02/01/2023
Show Less
Report","₹6,00,000 /yr (est.)",-1,-1,-1,-1,-1,-1,0,0,Claim Genius india Pvt Ltd,-1,1,0,0,1,1
"Mu Sigma | Mega Job-A-Thon
4.3",Trainee - Data Science,Bangalore,"Solving a problem can be as simple or as complicated as you make it to be. But the key to
solving a problem is Asking the right questions to enable the process of decision making.
This is where we come in we solve problems by bringing down the cost of asking questions.
Mu Sigma is one of the worlds largest Decision Sciences and Analytics firm. We help over
140 Fortune 500 clients, across 10 industry verticals, to institutionalize data-driven decision
making, and to harness Big Data. We provide our clients with a holistic ecosystem of
proprietary technology platforms, processes, and people. This ecosystem helps us scale the
use of our unique interdisciplinary approach of combining math, business, technology,
behavioral science and design thinking to operationalize Decision Science as opposed to Data
Science.
Our unique approach to problem solving using cross-industry expertise corroborates our
sustainable engagement model with our clients still further, making us one of the most
preferred analytics and Decision Sciences partners.
With over 3000 Decision Sciences professionals, we take pride in being a category and career
defining company. As we continue to scale, we are also looking at hiring the right talent
across various levels in our organization. Our unique talent management philosophy has
been critically acclaimed by the likes of Harvard Business Review.

Role & responsibilities:
Take actions to ensure healthy growth of the engagement with focus on high quality
delivery and client relationships
Collaborate with the client services team to assess and take decisions regarding the
health of the engagement
Work with your team to solve complex problems. Typically, these business problems
cannot be solved using a linear/single line of thought. Use first principle thinking,
coupled with basics of math and technology to arrive at a robust solution design,
while collaborating with the others in the team
Provide support for projects in areas ranging from: core data engineering, design
architecture, cloud capabilities to mathematical model building, evaluation, and
operational support
We have an open work culture, and we encourage sharing of ideas. You would see
yourself sharing ideas and participating in discussions with team members across
teams. You would be dealing with problems from team members, direct reports and
superiors from various backgrounds and experiences.
Collaborate with the various business functions in Mu Sigma, like Sales, Marketing,
Mu Sigma University, Talent Management and Delivery & Innovation, helping them
from your experiences in delivery, and learning their way of operating, in return
The workday stretches into late evenings and you would find yourself talking to the
client, presenting insights from work and engaging the clients in discussions around
growth and future pipeline development. You would have to work on defining this
pipeline and ensuring growth is driven by great delivery and satisfactory client
engagement
In short, a day would involve delivery be it brainstorming on a project, QCing codes
on Python/R/SAS or whatever technology it takes, preparing a deck for delivering
insights and growth, collaborating with the India Leadership to come up with new
ideas and solution design, driving client conversations centered around growth and
guiding team members across the lifecycle of the engagement
Skills & Competencies:
Possess strong analytical/logical thinking skills and clarity of thought to identify and solve business problems
Ability to learn complex businesses very quickly, define problems accurately while paying attention to detail in the solution
Good to have experience in Excel, VBA/Macros, SQL, SAS/R
Competency and interest in Business Technology, both academically and professionally, is preferred
Ability to extract and analyze data from multiple sources using analytical tools
Ability to manage and multi-task under tight deadlines
Strong interpersonal and communication skills
Demonstrated leadership within or outside a work setting. You should be someone who frequently takes initiative and is eager to break new ground
Preferable Qualities
Ready to take ownership of multiple applications
Ready to stretch beyond normal hours during build and high support activity times
Qualification
Graduated B.E/B.Tech any domain in 2019 / 2020/2021/2022 with aggregate of 7 CGPA
A minimum aggregate of 70% in class 10th and 12th
Show Less
Report","₹4,60,976 /yr (est.)",201 to 500 Employees,Company - Private,Education,Colleges & Universities,-1,Unknown / Non-Applicable,0,0,Mu Sigma | Mega Job-A-Thon,-1,1,0,0,0,1
Innomatics Research Labs,Machine Learning and AI Trainer,Hyderābād,"Job description
Experience
Minimum 4+ Years of experience in machine learning & data analytics,AI.
Expert knowledge in Python, Statistics, Machine Learning, Artificial Neural Networks, Convolutional Neural Networks, Recurrent Neural Networks, and NLP.
Very good knowledge of Django/Flask, SQL, and TABLEAU is preferable.
Deployment on AWS/GCP/Azure is preferable.
Real-Time experience of working on Data Science (ML, DL & NLP) Projects is mandatory.
Methodical and Aggressive learner.
Roles & Responsibilities:
Should be willing to handle Offline & Online training sessions.
Deliver daily lectures and maintain high lecture rating
Identify the gaps in learning when working with students.
Design and develop engaging study material and content.
Good at managing the cross-team effort
Develop and deliver a complete end to end Data Science Projects
Job Types: Full-time, Part-time, Regular / Permanent, Freelance
Salary: Up to ₹1,200,000.00 per year
Schedule:
Morning shift
Ability to commute/relocate:
Nizampet X roads, Hyderabad - 500085, Telangana: Reliably commute or planning to relocate before starting work (Required)
Experience:
total work: 1 year (Preferred)
Job Types: Full-time, Part-time, Regular / Permanent, Freelance
Salary: Up to ₹1,200,000.00 per year
Schedule:
Morning shift
Ability to commute/relocate:
Hyderabad - 500085, Telangana: Reliably commute or planning to relocate before starting work (Required)
Experience:
total work: 1 year (Preferred)
Speak with the employer
+91 8008441993
Show Less
Report","₹12,00,000 /yr (est.)",-1,-1,-1,-1,-1,-1,0,0,Innomatics Research Labs,-1,1,0,0,1,0
Centre For Translational Cancer Research -Prashanti Cancer Care Mission,Junior Data Scientist (Breast Cancer Clinical Data),Pune,"Job Description: Junior Data Scientist (Breast Cancer Clinical Data)
We at PCCM-CTCR are looking for the following candidate to join our Data Team to evolve the existing system and design the needed schema for research and medical-related data.
Responsibilities:
Knowledge of different information types and domains and aptitude to understand domains in the clinical field.
Some familiarity with GUI design and implementation and comfort with python is preferred.
Good communication skills and ability to work independently
Clinical Data entry, management and curation
Clinical Data record keeping
General project Administration and Reporting
Understanding and analysis of clinical metadata sheets.
You may also be required to contribute to various other verticals as needed.
Culture:
Applicant must own his/her work
Precision and diligence is a prerequisite
No compromise with our core values
The position is based in Pune city
This is a full time position
Work from home option is not available for this position.
6 days a week 10:00 am to 6:00 pm
Research Centre Profile:
Prashanti Cancer Care Mission, Pune has a growing Breast Cancer Research department. In a powerful model of public-private partnership, IISER Pune and Prashanti Cancer Care Mission established the Center for Translational Cancer Research (CTCR). CTCR aims to bring together clinicians and researchers to integrate breast cancer research, training, and education. This Centre is a first-of-its-kind initiative in India with world-class infrastructure and facilities for multidisciplinary training in translational cancer research. We anticipate that the activities of the Centre will have a direct positive impact on the national capacity for translational cancer research and, most importantly, on effective management of cancer in India. CTCR is the leading member in the formation of ICGA foundation. ICGA aims to build teams for multi-omics studies in Indian cancers. CTCR also has a valuable association with Persistent Systems and is initiated with a seed grant from Bajaj Auto
Job Type: Full-time
Salary: ₹25,000.00 - ₹35,000.00 per month
Benefits:
Health insurance
Schedule:
Day shift
COVID-19 considerations:
Yes
Application Question(s):
List experience or degree in Biological Sciences
Experience:
total work: 2 years (Required)
Show Less
Report","₹30,000 /mo (est.)",-1,-1,-1,-1,-1,-1,0,1,Centre For Translational Cancer Research -Prashanti Cancer Care Mission,-1,1,0,0,0,0
"Mercedes-Benz Research and Development India Private Limited
4.2",Computer Vision Research/ Platform Engineer - Machine Learning,Bangalore,"Aufgaben
Summary:
The research engineer will work with a dynamic team of programmers and algorithm developers to realize in-cabin environment perception using computer vision algorithms for Mercedes-Benz cars.

Necessary Skills:
Proficient in at least two of Python, MATLAB.
Industry/academic experience with machine learning and computer vision programming using libraries such as PyTorch, TensorFlow, OpenCV, Caffe
Strong project experience involving algorithm development for computer vision applications.
Demonstrated past algorithm development in at least one area within machine learning like neural networks, clustering, object tracking.
Experience with object classification, gesture recognition or human pose estimation and training deep neural networks using synthetic and artificial data.
Strong background and understanding of mathematical concepts relating to probabilistic models, conditional probability, numerical methods and linear algebra.
Self-motivated individual with passion towards state-of-the-art computer vision technologies.
Clear communication skills (English)
Qualifikationen
Basic Education:
Masters/Doctorate in Computer/Electronics Engineering with strong programming and scripting skills.



Years of experience: 3 to 6 Years

Nice to have:
Degree from premier institutes in Europe/USA or India (IITs/NITs/IIITs)


Experience with computer vision application development on the lines of gesture recognition, human gaze recognition, semantic segmentation, depth from stereo, object detection and tracking.


Experience working with synthetic and artificial data to solve real world problems.


Exposure to neural network libraries like Caffe, PyTorch, Theano or TensorFlow.
Show Less
Report","₹8,33,972 /yr (est.)",10000+ Employees,Company - Public,Manufacturing,Transportation Equipment Manufacturing,1886,Unknown / Non-Applicable,0,0,Mercedes-Benz Research and Development India Private Limited,136,1,0,0,0,0
AgEye Technologies,Computer Vision Engineer,Bangalore,"Job: Computer Vision Engineer
Position Type: Full-time – Permanent
Location: Bangalore, Karnataka (IN)
Key Responsibilities:
Working with the data science team to research, develop, evaluate and optimize various computer vision and deep learning models for different problems.
Explore and analyze unstructured data like images through image processing.
Take ownership to drive computer vision solutions and meet customer requirements.
Deploying developed computer vision models on edge devices after optimization to meet customer requirements and maintain them to later improve to address additional customer requirements in future.
Required Characteristics:
MSc or PhD in Computer Science, Data Science, Machine Learning or in related fields preferred but candidates with Bachelor’s degree in computer science are also welcome to apply provided they have a strong technical knowledge and experience in computer vision.
Understanding about depth and breadth of computer vision and deep learning algorithms.
At least 2 years of experience in computer vision and/or deep learning for object detection and tracking along with semantic or instance segmentation either in academic or industrial domain.
Experience with any machine/deep learning frameworks like Tensorflow, Keras and PyTorch.
Experience in training models through GPU computing using NVIDIA CUDA or on cloud.
Ability to transform research articles into the working solutions to solve real-world problems.
Strong experience in using both basic and advanced image processing algorithms for feature engineering.
Proficiency in Python and related packages like numpy, scikit-image, PIL, opencv, matplotlib, seaborn, etc.
Excellent written and verbal communication skills for effectively communicating with the team and ability to presenting information to varied technical and non-technical audience.
Must be able to produce solutions independently in an organized manner and also be able to work in a team when required.
Must have good Object-Oriented Programing & logical analysis skills in Python.
Preferred Characteristics (not mandatory to have all):
Strong foundation in data structures and algorithms in Python or C++
Advanced knowledge in performance, scalability, numerical accuracy and best practices for implementing various solutions.
Proficiency with edge computing principles and architecture preferably for NVIDIA Jetson devices and Raspberry Pi.
Experience in different model optimization techniques apart from hyperparameter tuning to reduce memory usage without hindering the performance for deploying on edge devices.
Proficiency with AWS or Azure cloud computing environments.
Exposure to IoT technology.
Experience in Agile Application Development and Scrum methodologies to develop efficient, maintainable, readable and production-ready pipelines.
Must have curiosity, eagerness and motivation to be involved in Data Science and Image Processing.
Job Type: Full-time
Salary: ₹400,000.00 - ₹1,500,000.00 per year
Benefits:
Flexible schedule
Health insurance
Life insurance
Paid sick time
Provident Fund
Schedule:
Day shift
Flexible shift
Monday to Friday
Speak with the employer
+91 9113072108
Show Less
Report","₹9,50,000 /yr (est.)",-1,-1,-1,-1,-1,-1,0,0,AgEye Technologies,-1,1,0,0,1,1
Evvo Technology Solutions Pvt Ltd,Machine Learning Engineer,Chennai,"Machine Learning Engineer - 3 positions
Experience - 8+ years Experience
Master’s degree in Computer Science, Mathematics or similar field
** Depends on project need - Experience in Knowledge based graphs technology and using reasoners. – ex: neo4j
Azure certification and Databricks certification
8+ years of experience in AI & DL methodology
AI Frameworks such as Tensorflow, Pytorch, and Keras
Expert in Azure Cloud (*Machine Learning*: Event Hub/Streaming Analytics, HDI, DB, Azure ML, Azure Log Analytics, Databricks)
Experience with Spark DataFrame and SQL API’s required. Spark streaming/structured streaming are nice to have
Proven experience as a Machine Learning Engineer or similar role
Understanding of data structures, data modeling and software architecture
Deep knowledge of math, probability, statistics and algorithms
Experience with Python and development environment. Ability to write robust code in Python, Java and R
Experience with Databricks and Jupyter Notebooks
Experience contributing to open source projects.
Excellent communication skills
Ability to work in a team
Job Type: Full-time
Salary: From ₹50,000.00 per month
Schedule:
Monday to Friday
Morning shift
Ability to commute/relocate:
Chennai - 600096, Tamil Nadu: Reliably commute or planning to relocate before starting work (Required)
Experience:
total work: 8 years (Required)
Show Less
Report","₹50,000 /mo (est.)",-1,-1,-1,-1,-1,-1,0,1,Evvo Technology Solutions Pvt Ltd,-1,1,0,1,0,1
Trovech Infotech Pvt Ltd,Data Scientist,Bangalore,"JD for Data Scientist Responsibilities & Skills · PhD in Statistics, Math or Computer Science is preferred. Must have at least a Master degree with 5+ years of experience. · Excellent statistical analysis skills to identify patterns in data. This includes having a keen sense of pattern detection and anomaly detection. · Excellent understanding of machine learning techniques and algorithms, such as k-NN, · Naive Bayes, SVM, Decision Forests, etc. · Must be able to implement algorithms and statistical concepts to build predictive models. · In-depth experience with common data science tools such as TensorFlow, PyTorch or equivalent. · Proficient in programming with python, SQL and No-SQL databases; and data science libraries such as nltk, numpy, scipy and many others · Communicate with global English speaking teams. · Expertise in collaborating with multi-disciplinary teams of business analysts, data scientists, subject matter experts, and developers For more information Contact HR Ranjini 7760520330
Job Type: Full-time
Salary: From ₹80,000.00 per month
Schedule:
Morning shift
Speak with the employer
+91 7760520330
Show Less
Report","₹80,000 /mo (est.)",-1,-1,-1,-1,-1,-1,0,1,Trovech Infotech Pvt Ltd,-1,1,0,0,0,1
InTechHub Solutions,AI/ML Engineer,Remote,"Job description
Able to handle End-to-End Machine Learning workflow which includes activities like Data Collection, Feature Engineering and Data transformation, Model training, and deploying models in production
Hands-on experience in Deep Learning models for computer vision problems with Expert level knowledge with Deep Learning frameworks TensorFlow, Keras, Fastai, and PyTorch and Computer Vision libraries like OpenCV, OpenVino, SciPy, NumPy, TensorRT, CUDA
Hands-on experience in algorithms and implementation of analytics solutions in predictive analytics, text analytics, and image analytics
Engaging key stakeholders to source, mine, validate data and findings and confirm business logic and assumptions to conclude.
Transferring requirements to optimization and learning problems
Leads efforts to foster innovative ideas for developing high-impact solutions.
Evaluates and leads a broad range of forward-looking analytics initiatives, tracks emerging data science trends, and knowledge sharing
Able to understand various data structures and common methods in data transformation
Helps design and develop advanced analytic solutions across functional areas per requirement/opportunities.
Communicate complex quantitative analysis in a lucid, precise, clear, actionable insight.
Developing new practices and methodologies using statistical methods, machine learning, and predictive models.
Carrying out statistical and mathematical modeling, solving complex business problems, and delivering innovative solutions using state-of-the-art tools and cutting-edge technologies for big data & beyond.
Research and evaluate new open-source technologies and frameworks to solve problems & improve existing solutions
Articulate and present the business value of your product design to different stakeholders and user
Required Candidate profile
Demonstrated strong capability in statistical/Mathematical modeling Machine Learning or Artificial Intelligence
Experienced in AI use cases deployment
Mathematical derivation and optimization of algorithms
Excellent pattern recognition and predictive modeling skills
Sound Experience with traditional as well as modern statistical techniques, including Regression, Support Vector Machines, Regularization, Boosting, Random Forests, and other Ensemble Methods;
Strong experience in Deep Learning models for computer vision problems with Expert level knowledge with Deep Learning frameworks TensorFlow, Keras, Fastai, and PyTorch
Strong knowledge of Computer Vision libraries like OpenCV, OpenVino, SciPy, NumPy, TensorRT, CUDA
Successful history of manipulating, processing, and extracting value from large, disconnected datasets and Data Ingestion, processing of structured and unstructured data in big data ecosystem - Hadoop, Spark, and Spark Streaming
Experience in designing and developing ML algorithms (Kernel Method, Ensemble Method, Semi-Supervised, Reinforcement Learning)
Experience in Data Visualization Tools (e.g., Qlik, Tableau, SAP BusinessObjects, and Power BI) would be added advantage
Experience with one or more of the following areas: Server Backend Distributed and Parallel Systems, Full Stack Development (front end and backend), Scalable Enterprise Platforms and Applications, Application Security and Incident Management, Machine Learning, Information Retrieval or Natural language processing.
Perks and Benefits
Permanent Work From Home Opportunity
Job Types: Full-time, Regular / Permanent
Salary: ₹600,000.00 - ₹1,000,000.00 per year
Benefits:
Flexible schedule
Health insurance
Work from home
Schedule:
Day shift
Flexible shift
Experience:
total work: 2 years (Preferred)
AI/ML: 1 year (Preferred)
Computer Vision or Image modelling: 1 year (Preferred)
Show Less
Report","$8,00,000 /yr (est.)",-1,-1,-1,-1,-1,-1,0,0,InTechHub Solutions,-1,0,0,1,0,1
